{
  "chips": {
    "label": "chips",
    "zhName": "薯片",
    "icon": "chips.png",
    "attribute": "脆性高加工零食",
    "category": "高加工零食",
    "portionDesc": "1 小包（约 30g）",
    "portionKcal": 160,
    "unit": "g",
    "standardAmount": 30,
    "amountPerSecond": 0.25,
    "minAmount": 10,
    "maxAmount": 60,
    "nutritionTags": ["高油", "高盐"],
    "riskNote": "高加工零食，建议控制食用频率"
  },
  "cabbage": {
    "label": "cabbage",
    "zhName": "卷心菜",
    "icon": "cabbage.png",
    "attribute": "脆爽蔬菜",
    "category": "蔬菜",
    "portionDesc": "1 份（约 150g）",
    "portionKcal": 35,
    "unit": "g",
    "standardAmount": 150,
    "amountPerSecond": 0.5,
    "minAmount": 50,
    "maxAmount": 300,
    "nutritionTags": ["膳食纤维", "维生素C"],
    "riskNote": "脆爽蔬菜，适合清炒或生食"
  },
  "gummies": {
    "label": "gummies",
    "zhName": "软糖",
    "icon": "gummies.png",
    "attribute": "黏弹性零食",
    "category": "高加工零食",
    "portionDesc": "1 小袋（约 25g）",
    "portionKcal": 90,
    "unit": "g",
    "standardAmount": 25,
    "amountPerSecond": 0.28,
    "minAmount": 8,
    "maxAmount": 60,
    "nutritionTags": ["高糖", "明胶"],
    "riskNote": "黏弹性零食，糖分较高，建议少量食用"
  },
  "noodles": {
    "label": "noodles",
    "zhName": "面条",
    "icon": "noodles.png",
    "attribute": "软性主食",
    "category": "主食",
    "portionDesc": "1 碗（约 200g）",
    "portionKcal": 280,
    "unit": "g",
    "standardAmount": 200,
    "amountPerSecond": 0.33,
    "minAmount": 60,
    "maxAmount": 400,
    "nutritionTags": ["碳水化合物"],
    "riskNote": "主食类，建议与蔬菜搭配食用"
  },
  "carrot": {
    "label": "carrot",
    "zhName": "胡萝卜",
    "icon": "carrot.png",
    "attribute": "脆爽蔬菜",
    "category": "蔬菜",
    "portionDesc": "1 根（约 100g）",
    "portionKcal": 40,
    "unit": "g",
    "standardAmount": 100,
    "amountPerSecond": 0.55,
    "minAmount": 30,
    "maxAmount": 250,
    "nutritionTags": ["膳食纤维", "胡萝卜素"],
    "riskNote": "适合生食的脆爽蔬菜"
  },
  "drink": {
    "label": "drink",
    "zhName": "饮料",
    "icon": "drink.png",
    "attribute": "液体",
    "category": "饮品",
    "portionDesc": "1 杯（约 250ml）",
    "portionKcal": 60,
    "unit": "ml",
    "standardAmount": 250,
    "amountPerSecond": 4.2,
    "minAmount": 100,
    "maxAmount": 600,
    "nutritionTags": ["含糖饮料"],
    "riskNote": "含糖饮品，建议以白水替代"
  }
}
